Department,Sub Dept 1,Sub Dept 2,Course_Name,ID,Grade Level(s),Prerequisite,Description,Term
Science,,,AP Physics C,58170,11th - 12th,"Science: A- in Honors Physics or B AP Physics 1 
Math: B in A.P. Calculus or AP Calculus concurrently 
Departmental approval is necessary in all cases.","This is actually two one-semester courses, culminating in a separate AP exam for each at the end of the year: Mechanics, and Electricity and Magnetism. Both semesters employ introductory calculus in problem solving and are designed to build on and expand on some of the topics covered in Honors Physics. Topics in Mechanics include kinematics, conservation of energy, rotational dynamics, and angular momentum.  Second semester topics include electric fields, Gauss’s Law, electric potentials, magnetism and electromagnetic induction. Upon completion of the course, students will be prepared for both AP Physics C exams as well as having the foundations for engineering in college.",Full Year
Science,,,Astrophysics (s),58173,"10th – 12th (10th graders must take concurrently with core science course) 
Placement preference will be given to rising Juniors and Seniors.",Math: Algebra II prior or concurrently,"This course will dive into current topics in cosmology while using physics as a background. All of the necessary physics will be taught within the course, and will not require math beyond algebra II. Topics will include the nature of light and gravity, and how those topics link to most everything we know about our universe.  We will discuss stellar formation, energy generation, and lifecycles. We will introduce relativity and other more modern topics in astronomy including (but not limited to) dark matter and energy, the physics of the big bang, and extrasolar planets. We will also spend time learning the nuts and bolts of observational astronomy.",Semester 2 - Spring
Science,,,Biology,51000,9th,None,"This course will help to develop an appreciation for the beauty, complexity and diversity of living systems. The focus of the course is on both the juxtaposition and similarity of the physiological processes present in all living things and how these connections help us understand natural selection and other evolutionary processes. The course is taught as a unified subject rather than disconnected units, and through classroom and laboratory experiences, students will accumulate a set of concrete proficiencies from which they can draw in future science courses.",Full Year
Science,,,Biology of Human Health (f),58036,"10th – 12th (10th graders must take concurrently with core science course)
Placement preference will be given to rising Juniors and Seniors.",Science: Biology,"What are opioids, how do they affect the body, and what are we doing, as a society, about the current opioid epidemic? How does your immune system protect you from various bacterial and viral infections? How do antibiotics and vaccines aid your body’s fight against these pathogens? Should vaccines be mandated by the government? Biology of Human Health will investigate these modern health issues in addition to discussing the science behind cancer, neurological disorders, and the current research being done to help understand and fight these diseases. Coursework includes case studies, research presentations, laboratory exercises, and debates.",Semester 1 - Fall
Science,,,Chemistry,52000,10th - 12th,Biology,"Students will have an overview of the fundamental principles of chemistry. The course examines the composition of various substances and the changes they can undergo. Major topics are introduced via classroom work as well as laboratory experiments and include: atomic theory, chemical bonding, stoichiometry, properties of solutions, gas laws, thermodynamics, redox, equilibrium, and acid-base reactions. The course features both qualitative and quantitative analyses of the relationships between variables associated with chemical reactions. Inquiry-based laboratory experiences are included throughout the year.",Full Year
Science,,,Culinary Science I (f),56041,10th - 12th  (Placement preference will be given to rising Seniors) ,Biology and Chemistry (concurrently for 10th grade students),"Good science is the backbone of good cooking. In this course, we’ll use GA’s state of the art culinary lab to bring the scientific method into the kitchen. Students will be asked to design experiments to improve the taste, texture, and aroma of food. We’ll apply basic principles of biology and chemistry learned in previous courses to perfect our recipes. As we attempt to achieve food nirvana, we’ll tackle everything from breakfast to dessert. Students who elect to take this course should have an adventurous palette, a healthy appetite, and an enthusiasm for science. By the end of the course, students will have a strong foundation in various cooking techniques and will be on their way to becoming lifelong learners in the kitchen.",Semester 1 - Fall
Science,,,Culinary Science II (s),56042,10th - 12th (Placement preference will be given to rising Seniors) ,Biology and Chemistry (concurrently for 10th grade students),"Pizza is undoubtedly one of the world’s best foods. However, most of the pizza that we eat is mediocre at best. There is a lot that can go wrong when making pizza at home or even in a restaurant for that matter. Careful attention must be paid to ingredients, technique, and most importantly, the science behind what really makes an excellent pie. In this course, we’ll apply basic principles of biology and chemistry along with the scientific method to the pizza-making process. Using GA’s state of the art culinary lab and outdoor pizza oven, students will attempt styles like deep-dish, thin-crust, and everything in between. Want to know the difference between Detroit, New York, and New Haven style pizza? Even better, want to learn how to make really good versions of all three at home? Students who elect to take this course should have a healthy appetite, an adventurous palette for different toppings, and an enthusiasm for science. By the end of the course, students will have a strong foundation in making/shaping dough, selecting/preparing toppings, and sliding pies in and out of the oven. Pizza mastery takes years to achieve, but with the skill set learned in this course, pizza may eventually become part of your culinary wheelhouse.",Semester 2 - Spring
Science,,,Engineering and Robotics I (f),58039,12th only,Science: Two years of science,"This course will introduce students to the practical application of science through the completion of various engineering-build projects. Students will improve critical thinking skills through project-based challenges while learning about basic engineering disciplines and various software programs, and by utilizing the fabrication machines and tools within the engineering shop.  Students will be required to work in groups and demonstrate strong teamwork and communication skills.  This course will allow students to be creative and innovative while applying math and science concepts to solve specific challenges.",Semester 1 - Fall
Science,,,Engineering and Robotics II (s),58040,12th only,Two years of science,"This course will introduce students to the practical application of science through the completion of various engineering-build projects. Students will improve critical thinking skills through project-based challenges while learning about basic engineering disciplines and various software programs, and by utilizing the fabrication machines and tools within the engineering shop.  Students will be required to work in groups and demonstrate strong teamwork and communication skills.  This course will allow students to be creative and innovative while applying math and science concepts to solve specific challenges.",Semester 2 - Spring
Science,,,Environmental Science and Sustainability (s),58042,"10th – 12th (10th graders must take concurrently with core science course)
Placement preference will be given to rising Juniors and Seniors.","Biology (current or past APES students are not eligible for this course, but APES is potentially an option after the completion of this course)","This course (modeled after an academic major at Cornell University) seeks to advance students’ ability to understand and address real world environmental problems, manage social ecological systems in a sustainable manner, and affect decisions involving environmental policy, resource management, and biodiversity conservation. Although categorized as an environmental science, this course delivers an interdisciplinary and integrated experience that provides both breadth and depth about the causes, consequences, and management or remediation of environmental problems ranging from local to global. Although challenging, the curriculum leaves students flexibility to pursue greater depth in specific areas of environmental science and sustainability, and to expand their knowledge outside of a core curricular course.",Semester 2 - Spring
Science,,,Forensic Science & Investigation (s),58033,"10th – 12th (10th graders must take concurrently with core science course) 
Placement preference will be given to rising Juniors and Seniors.",Science: Biology,"Beginning with a historical look at the development of forensics and modern techniques, we will learn the basis for forensic study and tools as well as utilizing the methods ourselves in laboratory investigations. Topics that we will cover include, but are not limited to, fingerprinting, blood analysis, direct and microscopic investigation of crime scenes, DNA collection and analysis, ballistics and toxicology. Famous cases and famous forensic investigators are studied as a backdrop for learning the scientific steps beyond modern forensic advancements.  ",Semester 2 - Spring
Science,,,Honors Biology,51020,9th,"Science: A- in 8th Grade Science AND
Math: Honors Math or Accelerated Math concurrently
Departmental approval is necessary in all cases.","This course offers a comprehensive investigation of high school biology. Although the course strives to develop an appreciation for the beauty, complexity and diversity of living systems, each topic is explored in-depth. Students are exposed to significantly more vocabulary and detailed processes, and an emphasis is put on the development of scientific-inquiry skills that will enable students to become more sophisticated in conducting investigations and explaining their findings. Topics include: ecology, evolution, genetics, biochemistry, cell biology, as well as animal and plant physiology.",Full Year
Science,,,Honors Chemistry,52020,10th - 12th,"Science: B in Honors Biology AND
Math: B+ in Honors Geometry, or A- in Accel. Geometry, or B in any level Algebra II
Departmental approval is necessary in all cases","This course offers a comprehensive introduction to the fundamental principles of chemistry. Topics include: atomic theory, chemical bonding, stoichiometry, properties of solutions, gas laws, thermodynamics, redox, equilibrium, and acid-base reactions. These areas are covered through classroom work as well as laboratory experiments. Inquiry-based laboratory experiences are included throughout the year. The course stresses a more quantitative approach to the major topics covered. Upon completion of the year, the student is well positioned for more advanced courses within the discipline.",Full Year
Science,,,Honors Physics,53020,10th - 12th,"Science: B in Honors Biology or A in Biology and/or B in Honors Chemistry, or A in Chemistry
Math: Minimum of B+ in Accelerated or Honors Math
Departmental approval is necessary in all cases.","Honors Physics is a full-year foundations class designed to prepare students for more advanced work in physics. The course content centers around the basic core topics in physics, including but not limited to kinematics, Newton's Laws, sound, light, electricity, and magnetism. Each topic is accompanied by a lab exercise(s) and demonstration(s) meant to exhibit and reinforce the math and concepts covered. Both the class content and lab work require strong algebra skills and some trigonometry. The goal of the combination of class and lab is to foster the necessary analytical skills required at this level as well as permitting advancement in the subject.",Full Year
Science,,,Honors Science Research - Brunswick School,59100,10th and 11th (10th graders must take concurrently with a core science course),"Science: A- in Biology 
Departmental approval is necessary in all cases.","This course is designed to expose students to a variety of laboratory techniques, as well as teach students how to conduct scientific research. Over the course of two years students will investigate and experiment with lab techniques used in various science disciplines using both traditional and state-of-the-art protocols. Students will also be taught the process of research by exploring topics of interest, designing an original project, completing that project with an accompanying paper, and submitting that project to a scientific competition. Student work will be published in Brunswick’s Journal of Scientific Research. It is expected/required that each student enrolled in the class will also participate in summer science work as an intern, a scholar/participant in a reputable college summer science program, or attend a two-week, field-research trip with the class. Summer placement is instructor-assisted and individualized based on student commitments.",Full Year
Science,,,Honors Seminar: Science Research (GA),56037,11th - 12th,Departmental approval is necessary in all cases.,"The objective of this course is to train students in designing and executing a research project. The classroom is actually a research lab, and the class is a research group. The focus of the research is the isolation and initial characterization of soil microbes that exhibit antimicrobial properties. We have partnered with The Small World Initiative/Tiny Earth, organizations that are focused on the search for new antibiotics through the methods we will use in this course. Each student will be the director of their individual project while at the same time contributing to the understanding and work of the entire group. Students will be assessed on their understanding of the project, their work related to the broader goal, as well as the underlying microbiology concepts and techniques they are performing.",Full Year
Science,,,Human Physiology I (f),58030,"10th – 12th (10th graders must take concurrently with core science course)
Placement preference will be given to rising Juniors and Seniors.",Science: B in Biology,"The overall theme of this course is the human body, its organization, and its physiology. This course is designed as a further study of biology and biochemistry for those students wishing to expand their biological experience and who are possibly considering a pre-medical course of study in college. Beginning with a re-introduction to the body, a navigation of the basic biochemistry of cells and tissues is undertaken to lay a foundation for studying the various systems of the body individually. Systems to be studied include the integumentary, musculoskeletal, nervous (including special senses) and cardiovascular. This is a laboratory course with experiments and experiences using students themselves as laboratories in addition to dissection opportunities.",Semester 1 - Fall
Science,,,Human Physiology II (s),58031,"10th – 12th (10th graders must take concurrently with core science course)
Placement preference will be given to rising Juniors and Seniors.","Science: B in Biology
Human Physiology I is NOT a prerequisite for this course.","The overall theme of this course is the human body, its organization, and its physiology. This course is designed as a further study of biology and biochemistry for those students wishing to expand their biological experience and who are possibly considering a pre-medical course of study in college. Beginning with a re-introduction to the body, a navigation of the basic biochemistry of cells and tissues is undertaken to lay a foundation for studying the various systems of the body individually. Systems to be studied include the respiratory, urinary, digestion, immune and endocrine. This is a laboratory course with experiments and experiences using students themselves as laboratories in addition to dissection opportunities.",Semester 2 - Spring
Science,,,Impact of Technology: An Economic Perspective (f),38412,10th - 12th,None,"Technology advances drive commercial growth in the global economy. This course begins with a brief historical review of how major technological advances have impacted our economy.  Examples include the transistor/microprocessor, the telephone and the airplane.  Each student will explore the economic impact of one of these advances in depth.

A substantial majority of the course looks to the future.  Many potential technology advances are likely to have a disruptive impact on our current economic situation.  Our objective is to engage students in thinking about the future – and explore how these technologies will influence growth.  Students will select a technology of focus, research its potential impact, and present their findings to the class.",Semester 1 - Fall
Science,,,Marine Biology (f),58038,"11th – 12th
Placement preference will be given to rising Seniors.",Science: B in Biology and two years of science (second year can be concurrent) ,"This one semester course provides an introduction to oceanography and marine biology. During the first part of the course students will investigate oceanography including units on marine research, the sea floor, chemical and physical properties of seawater, and the world’s oceans. During the second part of the course students will learn about marine organisms including prokaryotes, those that photosynthesize, multicellular invertebrates, and a brief survey of marine vertebrates. Evolution and marine ecology will be emphasized in each unit. Students will be assessed on content, varied lab experiences, and a major presentation. Sophomores are able to register for this course, but must take chemistry or honors chemistry concurrently.",Semester 1 - Fall
Science,,,Physics,53000,10th - 12th,Biology,"This course presents students with an overview of the fundamental principles of Physics. The course examines the physical world around us and how it works. Major topics include mechanics, thermodynamics, electricity, electromagnetism, sound and light. The course leans more toward the quantitative analysis to show mathematical relationships between variables of the equations. This course is designed to be a hands-on approach with emphasis on practical application on the concepts and theories. Laboratory experiments are an integral part of the course.",Full Year
Science,,,Principles of Geology (f),58044,"10th – 12th (10th graders must be taken concurrently with core science course)
Placement preference will be given to rising Juniors and Seniors.",Science: Two years of science (second year can be concurrent),"Principles of Geology presents an overview of Earth, from a geological perspective. We will emphasize that plate tectonics—the grand unifying theory of geology—explains how the map of our planet's surface has changed radically over geologic time, and why present-day geologic activity—including a variety of devastating natural disasters such as earthquakes, landslides and volcanoes—occur where they do.
















",Semester 1 - Fall
Science,,,Principles of Geology (s),58045,"10th – 12th (10th graders must be taken concurrently with core science course)
Placement preference will be given to rising Juniors and Seniors.",Science: Two years of science (second year can be concurrent),"Principles of Geology presents an overview of Earth, from a geological perspective. We will emphasize that plate tectonics—the grand unifying theory of geology—explains how the map of our planet's surface has changed radically over geologic time, and why present-day geologic activity—including a variety of devastating natural disasters such as earthquakes, landslides and volcanoes—occur where they do.",Semester 2 - Spring
Science,,,The History of Race and Science (s),38482,"10th – 12th (10th graders must take concurrently with core science course)
Placement preference will be given to rising Juniors and Seniors.",None,"Why has science been used to justify racial thinking? How does your racial identity develop during adolescence? How can reexamining history help us to eliminate interpersonal and systemic racism? The History of Race and Science explores the construct of race as a social and historical phenomenon. Beginning with the historical evolution of race, students will explore the role that science has played in perpetuating race, considering both the biological myth and social reality in context of the historical time period. In order to understand these concepts more fully, we will engage in an interdisciplinary exploration of eugenics, racial conflicts, intergroup behavior, identity development, and contemporary social justice issues. We will explore the construction of the racial-ethnic-cultural identities in the United States, incorporating multidisciplinary readings and activities. Along the way, students will discuss the historical events and patterns that have influenced the construction of race and resulting manifestation in society, working to develop a stronger understanding of the world today.",Semester 2 - Spring
World Languages,Arabic,,Arabic I,49100,9th - 11th ,None,"This beginning course is an introduction to Modern Standard Arabic, using a curriculum based on the Al-Kitaab series. Students learn the fundamentals of Arabic such as the alphabet, handwriting, and correct pronunciation of Arabic letters. Students become familiar and comfortable with the sounds and the structure of the language and later are introduced to the ancient art of Arabic calligraphy. A variety of activities are used to develop the four language skills: listening, speaking, reading, and writing. Cultural aspects are presented through authentic materials such as articles, videos, and Internet materials.",Full Year
World Languages,Arabic,,Arabic II,49200,,Arabic I and departmental approval,"Students in this course continue to develop their foundational skills in Modern Standard Arabic. More complex aspects of the language are introduced by developing listening and reading comprehension and building oral proficiency skills. In addition to using the textbook, students are introduced to a variety of Arabic language resources such as videos, radio programs, newspapers, and Internet sites allowing for greater cultural understanding of the different aspects of the Arab world.",Full Year
World Languages,Arabic,,Arabic III,49300,,Arabic II and departmental approval,"This course expands the students’ foundation of the Arabic language and culture as they continue to develop their oral proficiency and reading/listening comprehension. Students apply more complicated language structures in Modern Standard Arabic to a variety of topics related to a real-life situation, and develop their ability to write in Arabic with an introduction to modern and classic Arabic poetry.  Students also gain a deeper understanding of the world around them by using social, environmental, and historical issues to further their Arabic language and culture studies.",Full Year
World Languages,Arabic,,Arabic IV,49400,,Arabic III and departmental approval,"Students continue to develop and refine their proficiency in all four language skills, with an emphasis on developing fluency in speaking and in writing. Students apply new complex language structures in Modern Standard Arabic to a variety of topics related to a real-life situation, and develop the ability to move from concrete to abstract concepts. At this level, students comprehend the main ideas of authentic materials that they read and listen to, while also identifying salient details. Students learn a deeper understanding of the world around them, using social, environmental, economic and historical issues to further their Arabic language and culture studies.",Full Year
World Languages,Arabic,,Honors Arabic II,49201,,Minimum grade of A- in Arabic I and departmental approval,"This fast-paced course continues to develop the students foundational skills in Modern Standard Arabic. While studying topics related to daily life communicative skills, students progress in their oral and written proficiency. They experience real-life situations through interdisciplinary and cross-cultural classes with distinct schools in the US and abroad. Units on Arabic culture, as well as additional audio and video clips in Modern Standard Arabic and colloquial, are incorporated in the lessons to help students develop a broader insight into the region and an appreciation for their study of the Arabic language.",Full Year
World Languages,Arabic,,Honors Arabic III,49301,,Minimum grade of B+ in Arabic II Honors and departmental approval,"Students continue to develop and refine their proficiency in all four language skills, with an emphasis on developing fluency in speaking and in writing. Students apply new complex language structures in Modern Standard Arabic to a variety of topics related to a real-life situation, and develop the ability to move from concrete to abstract concepts. At this level, students comprehend the main ideas of authentic materials that they read and listen to, while also identifying salient details. Students learn a deeper understanding of the world around them, using social, environmental, economic, and historical issues to further their Arabic language and culture studies.",Full Year
